{
  "schema": "cthd.fixture-meta/1",
  "sourceId": "news-opb",
  "label": "rss-javascript-link",
  "file": "2026-10-05-rss-javascript-link.xml",
  "url": "https://www.opb.org/arc/outboundfeeds/rss/?outputType=xml",
  "method": "GET",
  "requestHeaders": {
    "User-Agent": "(atniclimate.github.io/pnw-tribal-dashboard, climate@atnitribes.org)",
    "Accept": "application/rss+xml, application/xml"
  },
  "capturedAt": "2026-10-05T06:25:56.283Z",
  "status": 200,
  "contentType": "application/xml; charset=utf-8",
  "lastModified": "Mon, 05 Oct 2026 06:24:12 GMT",
  "bytes": 139457,
  "sha256": "c2ccf39b38dc8f7d70764511d7825bb3e1c9bc300b042aa4292324ef98fe275a",
  "covers": [
    "javascript-link",
    "html-summaries"
  ],
  "derivedFrom": "2026-10-05-rss.xml",
  "edits": [
    "The <link> element of the first <item> was replaced with <link>javascript:alert(1)</link>. Every other byte is unchanged."
  ],
  "notes": "No live feed carries a javascript: link; this one-element edit proves the news task drops non-https links."
}
