{
  "schema": "cthd.fixture-meta/1",
  "sourceId": "nwps-gauges",
  "label": "gauge-qltw1",
  "file": "2026-10-05-gauge-qltw1.json",
  "url": "https://api.water.noaa.gov/nwps/v1/gauges/QLTW1",
  "method": "GET",
  "requestHeaders": {
    "User-Agent": "(atniclimate.github.io/pnw-tribal-dashboard, climate@atnitribes.org)",
    "Accept": "application/json"
  },
  "capturedAt": "2026-10-05T07:44:16.146Z",
  "status": 200,
  "contentType": "application/json",
  "lastModified": null,
  "bytes": 20224,
  "sha256": "90c974f7be9a8fb173cfea40cb9a11d7fdfd3386b95db2338f712f9431a5387d",
  "covers": [
    "gauge-detail",
    "legacy-stages"
  ],
  "derivedFrom": null,
  "edits": [],
  "notes": ""
}
